Question,Answer
Hi there,Hello! Am Bot Here to help you.
How are you,Good to see you again! Am Bot Here to help you.
Is anyone there?,"Hi there, how can I help?"
Hey,Hello! Am Bot Here to help you.
Hola,Hello! Am Bot Here to help you.
Hello,"Hi there, how can I help?"
Good day,"Hi there, how can I help?"
Bye,See you!
See you later,Have a nice day
Goodbye,Bye! Come back again soon.
"Nice chatting to you, bye",Bye! Come back again soon.
Till next time,Bye! Come back again soon.
Thanks,My pleasure
Thank you,You're Welcome
That's helpful,You're Welcome
"Awesome, thanks",My pleasure
Thanks for helping me,My pleasure
Good morning,Good morning! How can I help you today?
Good evening,Good evening! How can I assist you today?
Good afternoon,Good afternoon! How can I help you today?
Good night,"Good night! If you have any more questions, feel free to ask."
Tell me something,Certainly! What would you like to know?
Ok,"Okay! If you have any questions, feel free to ask."
Yes,Yes! How can I assist you today?
I’ll do that now,"Great! If you need any help along the way, feel free to ask."
Hello,Hello! Am Bot Here to help you.
Thank you,You're Welcome
Goodbye,Bye! Come back again soon.
How can you help me?,I'm here to provide information and assistance. What do you need help with?
What can you do?,"I can answer questions, provide information, and assist with various tasks. Feel free to ask me anything."
What is DocBerg?,DocBerg is an ever-evolving platform committed to improving and updating based on user feedback and AI advancements.
What does DocBerg offer?,"DocBerg offers services such as Listen Audio of PDF/Images, Chat Visualizer, Resume Analyzer, PDF conversion, and more."
What is Chat Visualizer?,Chat Visualizer provides profound insights about your chat with DocBerg's AI-powered tool.
What is Resume Analyzer?,Resume Analyzer offers profound insights about your Resume/CV with DocBerg's AI-powered tool.
What is PDF to Image?,PDF to Image converts your PDF documents into images with DocBerg.
What is Compress PDF?,Compress PDF allows you to compress your PDF documents using DocBerg.
What is Doc to PDF?,Doc to PDF converts Word Documents into PDF format with DocBerg.
What is Merge PDF?,Merge PDF allows you to select and merge multiple PDFs with DocBerg.
What is Image to PDF?,Image to PDF converts your images into PDF format with DocBerg.
What is PDF to Doc?,PDF to Doc converts PDF documents into Word Documents with DocBerg.
What is Compress Images?,Compress Images allows you to compress your images using DocBerg.
What is PNG to JPG?,PNG to JPG converts PNG images to JPG format with DocBerg.
What is JPG to PNG?,JPG to PNG converts JPG images to PNG format with DocBerg.
Tell me more about DocBerg features.,"DocBerg features include Listen Audio of PDF/Images, Chat Visualizer, Resume Analyzer, PDF conversion, Compress PDF, Doc to PDF, Merge PDF, Image to PDF, PDF to Doc, Compress Images, PNG to JPG, and JPG to PNG."
Tell me features.,"DocBerg features include Listen Audio of PDF/Images, Chat Visualizer, Resume Analyzer, PDF conversion, Compress PDF, Doc to PDF, Merge PDF, Image to PDF, PDF to Doc, Compress Images, PNG to JPG, and JPG to PNG."
Hello,Hi there! How can I help you with DocBerg today?
Wassup,Not much! Just here to assist you with any questions about DocBerg.
What are you doing?,I'm here to provide information and answer your questions about DocBerg. How can I assist you?
What are you doing?,I'm here to provide information and answer your questions about DocBerg. How can I assist you?
Address,We are operating remotely 
where to visit you,Mail us or Call us
